Firm Name,Website,Growth Oriented,Explanation,Sources Visited
Deloitte Denmark,https://www.deloitte.com/dk/da.html,Yes,"Highly growth-oriented firm with extensive focus on innovation and technology. Offers AI Customer Agent series, generative AI solutions, and enterprise technology services. Website demonstrates sophisticated infrastructure with Elasticsearch, real-time analytics, and dynamic media delivery. Services extend far beyond basic accounting to include strategy consulting, digital transformation, cyber security, and financial advisory. Strong emphasis on emerging technologies and future-focused services.","https://www.deloitte.com/dk/da.html, https://finmodelslab.com/blogs/blog/top-fifteen-accounting-firms-denmark"
PwC Denmark,https://www.pwc.dk,Yes,"Definitely growth-oriented with strong digital and innovation focus. Offers AI services, cloud transformation, digital trust services, and sustainability consulting alongside traditional audit and tax. Website shows sophisticated technical infrastructure with analytics tracking and dynamic content rendering. Positions itself as insights-driven with thought leadership content. Clear emphasis on digital-first service delivery and strategic advisory for business owners and corporate leaders.","https://www.pwc.dk, https://finmodelslab.com/blogs/blog/top-fifteen-accounting-firms-denmark"
BDO Denmark,https://www.bdo.dk/en-gb/home-en,Moderate,"Moderately growth-oriented - transitioning from traditional roots to modern practices. Provides audit, advisory, and business services with high-level strategic guidance. Website uses React components and modern analytics but lacks cutting-edge technology mentions like AI or blockchain. Emphasizes relationship-building and expertise sharing through publications. Positioned as comprehensive advisory firm rather than purely transactional, but not aggressively innovative.","https://www.bdo.dk/en-gb/home-en, https://finmodelslab.com/blogs/blog/top-fifteen-accounting-firms-denmark"
Beierholm,https://www.beierholm.dk/en,No,"Not particularly growth-oriented - traditional advisory firm with IT-consulting as secondary offering. Website shows moderate modern standards with basic analytics and responsive design, but no mention of AI, automation, or digital transformation. 5th largest firm in Denmark with ~2000 employees and 140 partners. Emphasizes traditional strengths like expertise, branch office network, and workplace culture rather than innovation. Part of HLB global network.","https://www.beierholm.dk/en, https://finmodelslab.com/blogs/blog/top-fifteen-accounting-firms-denmark"
Azets Denmark,https://www.azets.com/da-dk,Moderate,"Moderately growth-oriented with modern infrastructure but traditional focus. Website built on Next.js with Material-UI showing technical sophistication. Offers accounting, M&A advisory (100+ acquisitions), HR/payroll, and document management. However, messaging emphasizes human expertise over technology innovation. Large firm with 9000 experts across 190 offices in 8 countries. Leverages modern tech to enhance traditional consulting rather than disrupt the industry.","https://www.azets.com/da-dk, https://finmodelslab.com/blogs/blog/top-fifteen-accounting-firms-denmark"
Nexia Nordic,https://www.nexianordic.com,No,"Not growth-oriented - traditional service-oriented firm. The Danish member firm Christensen Kjaernulff offers audit, accounting, tax, and business administration. Minimal technological presence with only basic web technologies mentioned. No discussion of digital transformation, automation, or innovative solutions. Focus is on personal relationships with clients and established professional networks. Serves clients seeking conventional professional services rather than cutting-edge consulting.","https://www.nexianordic.com, https://finmodelslab.com/blogs/blog/top-fifteen-accounting-firms-denmark"
Dania Accounting,https://www.daniaaccounting.com,Moderate,"Moderately growth-oriented with solid technology integration but traditional core. Over 25 years experience serving 2000+ clients with comprehensive services including accounting, payroll, tax, ESG reporting, and CFO services. Integrates with multiple modern platforms: e-conomic, Microsoft Dynamics 365, SAP, Danløn, DataLøn, Zenegy, PLEO, Budget123. Growing advisory component suggests evolution toward higher-value services. However, no mention of AI or emerging technologies, and emphasis remains on regulatory compliance and expertise over innovation.","https://www.daniaaccounting.com, https://finmodelslab.com/blogs/blog/top-fifteen-accounting-firms-denmark"
Mercuria ApS,https://www.mercuria.dk,No,"Not growth-oriented - traditional security-focused accounting firm. Over 40 years experience offering basic services: bookkeeping, VAT reporting, annual statements, payroll, and tax returns. Emphasizes IT security with encrypted systems, own-managed servers (not cloud), FreeBSD/Ubuntu systems. Offers digital bookkeeping but doesn't emphasize innovation or advanced advisory. Targets small-to-medium enterprises with fixed pricing. Appears reliable and competent but conservative in approach, focusing on compliance and data protection rather than strategic business advisory.","https://www.mercuria.dk, https://finmodelslab.com/blogs/blog/top-fifteen-accounting-firms-denmark, https://www.angloinfo.com/copenhagen/directory/copenhagen-accountants-auditors-bookkeepers-360"
Buus Jensen,https://www.buusjensen.dk/en,Moderate,"Moderately growth-oriented with digital services and global network access. Full-service firm with 60 employees, 8 partners, serving 2000+ clients. Founded 60+ years ago, became partnership in 1986. Recently joined UHY International network (2025), providing clients expanded support beyond Denmark. Offers digital accounting system for bookkeeping, VAT, and payroll administration alongside audit, tax, and advisory services. Tailored support for SMEs and emerging businesses suggests client-centric approach, but limited information on advanced technology or innovation focus.","https://www.buusjensen.dk/en, https://www.uhy.com/insights/uhy-international-welcomes-danish-firm-buus-jensen-its-network-expanding-nordic-footprint, https://www.internationalaccountingbulletin.com/news/uhy-international-adds-buus-jensen/"
Martinsen,https://martinsen.dk/english,Moderate,"Moderately growth-oriented hybrid firm balancing tradition with professional evolution. Established since 1940 with 320 employees and 35 state-authorized accountants across 11 Danish offices. Comprehensive services including audit, tax (corporate/personal/international), ESG/sustainability advisory, ownership transitions, and IT consulting. Part of PrimeGlobal international network. Claims to be ""in the absolute frontline"" regarding data technology with data specialists, digital signature platform, and customer portal. However, technology references are vague without specific AI, automation, or fintech mentions. Emphasizes close personal cooperation suggesting relationship-driven rather than pure innovation focus.","https://martinsen.dk/english, https://finmodelslab.com/blogs/blog/top-fifteen-accounting-firms-denmark"
